<?xml version="1.0" encoding="UTF-8"?> 
<!-- Sample XML Document --> 
<ns:personnel xmlns:xsi="http://www.w3.org/2001/XMLSchema-instance"
 xsi:schemaLocation="http://www.foo.com XMLSample.xsd"
 xmlns:ns="http://www.foo.com">
   <ns:person id="Boss" >
      <ns:name>
         <ns:family>Smith</ns:family>
         <ns:given>Bill</ns:given>
      </ns:name>
      <ns:email>smith@foo.com</ns:email>
      <ns:yearsOfService>20</ns:yearsOfService>
      <ns:birthday>1955-03-24 oder so !?!</ns:birthday>
   </ns:person>
   <!-- A second comment in this Sample XML Document -->
   <ns:person id="worker">
      <ns:name>
         <ns:family>Jones</ns:family>
         <ns:given>Bill</ns:given>
      </ns:name>
      <ns:email>jones@foo.com</ns:email>
      <ns:yearsOfService>5</ns:yearsOfService>
      <ns:birthday>1968-07-16</ns:birthday>
   </ns:person>
   <ns:person id="worker">
      <ns:name>
         <ns:family>Jones</ns:family>
         <ns:given>Sam</ns:given>
      </ns:name>
      <ns:email>sjones@foo.com</ns:email>
      <ns:yearsOfService>5</ns:yearsOfService>
      <ns:birthday>1959-01-26</ns:birthday>
   </ns:person>
</ns:personnel>
